{
  "source_file_name": "Resume - Justiniano Tagarda.pdf",
  "name": "JUSTINIANO TAGARDA",
  "title": "FULL-STACK .NET DEVELOPER | ASP.NET · SQL Server · Web APIs · React",
  "profile": "Software Developer with 15+ years of experience designing, building, and maintaining enterprise-grade web and desktop applications using .NET, ASP.NET, and SQL Server. Strong background in IIS administration, system deployment, and database optimization. Proven track record delivering scalable, reliable business systems and full-stack solutions used in large-scale production environments. Extensive experience working remotely with distributed teams.",
  "work_experience": [
    {
      "job_title": "Backend Developer - ASP.NET & SQL Server",
      "company": "Drizzio / Digital Entrepreneur LLC",
      "location": "USA (Remote)",
      "start": "Nov 2024",
      "end": "Jan 2026",
      "responsibilities": [
        "Developed and maintained high-availability backend APIs using .NET, supporting production systems with thousands of daily users.",
        "Collaborated with stakeholders to translate business requirements into scalable backend solutions.",
        "Managed SQL Server performance, backups, and troubleshooting.",
        "Developed client-side components using Knockout.js and jQuery.",
        "Administered IIS deployments and server monitoring."
      ]
    },
    {
      "job_title": "Software Developer - Freelance",
      "company": null,
      "location": null,
      "start": "2021",
      "end": "Present (Active)",
      "responsibilities": [
        "Delivered end-to-end solutions for clients across e-commerce, internal business systems, and custom enterprise tools.",
        "Acted as technical lead, handling architecture, deployment, and post-launch support."
      ]
    },
    {
      "job_title": ".NET Developer / System Administrator",
      "company": "GEDAC Electric Company",
      "location": "Jeddah, Saudi Arabia",
      "start": "2007",
      "end": "2020",
      "responsibilities": [
        "Built the company website and multiple internal web applications, including an ERP and inventory system, to streamline operations and improve workflow efficiency.",
        "Developed a customer portal for real-time project monitoring and delivered web tools for branch office staff.",
        "Managed and supervised the IT department, ensured reliable systems, support, and technology alignment with business needs."
      ]
    },
    {
      "job_title": "Computer Programmer",
      "company": "Al Salem Kitchen Company",
      "location": "Jeddah, Saudi Arabia",
      "start": "1999",
      "end": "2006",
      "responsibilities": [
        "Developed a company-wide inventory system using MS Access to improve tracking, accuracy, and operational efficiency.",
        "Installed and configured LAN infrastructure across offices, factories, and warehouses, ensured stable connectivity and streamlined communication."
      ]
    }
  ],
  "skills": {
    "Backend": [
      "C#",
      ".NET",
      "ASP.NET",
      ".NET Core",
      "Web APIs"
    ],
    "Frontend": [
      "React",
      "Next.js",
      "Knockout.js",
      "jQuery",
      "TypeScript"
    ],
    "Databases": [
      "SQL Server",
      "NoSQL (document-based)",
      "Supabase"
    ],
    "DevOps & Infrastructure": [
      "Docker",
      "IIS",
      "Azure DevOps"
    ],
    "Tools": [
      "Git",
      "GitHub",
      "Visual Studio",
      "VS Code",
      "Microsoft Excel",
      "Windows PowerShell"
    ],
    "Collaboration": [
      "Jira",
      "Slack",
      "Figma"
    ],
    "AI Tools": [
      "ChatGPT",
      "GitHub Copilot"
    ]
  },
  "education": [
    {
      "degree_or_certificate": "Bachelor of Arts: Accountancy",
      "institution": "Xavier University College",
      "location": "Cagayan de Oro City, Philippines"
    },
    {
      "degree_or_certificate": "COBOL Programming (Certificate)",
      "institution": "Systems Technology Institute",
      "location": "Cagayan de Oro City, Philippines"
    }
  ],
  "contact": {
    "email": "justintagarda@gmail.com",
    "phone": "(+63) 927-380-0613",
    "linkedin": "www.linkedin.com/in/justintagarda",
    "portfolio": "www.justintagarda.com"
  },
  "extracted_text": "JUSTINIANO TAGARDA\nFULL-STACK .NET DEVELOPER | ASP.NET · SQL Server · Web APIs · React\nBackend Developer - ASP.NET & SQL Server\nDrizzio / Digital Entrepreneur LLC - USA (Remote)\nNov 2024 - Jan 2026\n• Developed and maintained high-availability backend APIs using .NET,\nsupporting production systems with thousands of daily users.\n• Collaborated with stakeholders to translate business requirements into\nscalable backend solutions.\n• Managed SQL Server performance, backups, and troubleshooting.\n• Developed client-side components using Knockout.js and jQuery.\n• Administered IIS deployments and server monitoring.\nSoftware Developer - Freelance\n2021 - Present (Active)\n• Delivered end-to-end solutions for clients across e-commerce, internal\nbusiness systems, and custom enterprise tools\n• Acted as technical lead, handling architecture, deployment, and\npost-launch support\n.NET Developer / System Administrator\nGEDAC Electric Company - Jeddah, Saudi Arabia | 2007-2020\n• Built the company website and multiple internal web applications,\nincluding an ERP and inventory system, to streamline operations and\nimprove workflow efficiency.\n• Developed a customer portal for real-time project monitoring and\ndelivered web tools for branch office staff.\n• Managed and supervised the IT department, ensured reliable systems,\nsupport, and technology alignment with business needs.\nComputer Programmer\nAl Salem Kitchen Company - Jeddah, Saudi Arabia | 1999-2006\n• Developed a company-wide inventory system using MS Access to\nimprove tracking, accuracy, and operational efficiency.\n• Installed and configured LAN infrastructure across offices, factories,\nand warehouses, ensured stable connectivity and streamlined\ncommunication.\nPROFILE\nWORK EXPERIENCE\nSoftware Developer with 15+ years of experience designing, building,\nand maintaining enterprise-grade web and desktop applications using\n.NET, ASP.NET, and SQL Server. Strong background in IIS\nadministration, system deployment, and database optimization. Proven\ntrack record delivering scalable, reliable business systems and\nfull-stack solutions used in large-scale production environments.\nExtensive experience working remotely with distributed teams.\nSKILLS\n• Backend: C#, .NET, ASP.NET, .NET\nCore, Web APIs\n• Frontend: React, Next.js,\nKnockout.js, jQuery, TypeScript\n• Databases: SQL Server, NoSQL\n(document-based), Supabase\n• DevOps & Infrastructure: Docker, IIS,\nAzure DevOps\n• Tools: Git, GitHub, Visual Studio, VS\nCode, Microsoft Excel, Windows\nPowerShell\n• Collaboration: Jira, Slack, Figma\n• AI Tools: ChatGPT, GitHub Copilot\nEDUCATION\nBachelor of Arts: Accountancy\nXavier University College\nCagayan de Oro City, Philippines\nCOBOL Programming (Certificate)\nSystems Technology Institute\nCagayan de Oro City, Philippines\nCONTACT ME\nEmail:\njustintagarda@gmail.com\nPhone:\n(+63) 927-380-0613\nLinkedIn:\nwww.linkedin.com/in/justintagarda\nPortfolio:\nwww.justintagarda.com\n\n-- 1 of 1 --"
}